,title,score,id,url,comms_num,created,body,timestamp
0,Cada vez que tenía que ir al cyber por una tarea. Créditos al gran @elgatomoncholo,1528,n6ijbf,https://i.redd.it/ylrfbqoalkx61.jpg,324,1620366140.0,,2021-05-07 02:42:20
1,El colectivero de los huevos de oro,802,n6ls62,https://v.redd.it/kut78lepclx61,150,1620375362.0,,2021-05-07 05:16:02
2,INADI con vos,681,n6x195,https://i.redd.it/xk3irix9wox61.png,70,1620418292.0,,2021-05-07 17:11:32
3,El gaucho de las pampas,453,n6gxlr,https://v.redd.it/zd1hsnf19kx61,67,1620362017.0,,2021-05-07 01:33:37
4,"What a período presidencial, huh?",428,n6vhjf,https://i.redd.it/msssrqq4fox61.png,9,1620412536.0,,2021-05-07 15:35:36
5,Parece una autocritica pero no lo es,426,n6y2oq,https://v.redd.it/gpy6nr366px61,72,1620421621.0,,2021-05-07 18:07:01
6,Kleochanta,387,n6mw0i,https://v.redd.it/waxjn5ugnlx61,77,1620378995.0,,2021-05-07 06:16:35
7,Momento santiageño,314,n6mcln,https://i.redd.it/swbjhgp5ilx61.jpg,110,1620377190.0,,2021-05-07 05:46:30
8,"Ves eso de ahí? Las llamamos ""casas""",312,n6i9ef,https://i.redd.it/jiv5pke6jkx61.jpg,41,1620365445.0,,2021-05-07 02:30:45
9,"Hoy, después de casi 6 años, mi madre cursó el último día de residencia y se recibe de maestra jardinera. Que no le aflojes y seas felíz siempre vieja ♥️.",363,n74aoq,https://i.redd.it/vxn76a6gjqx61.jpg,36,1620438176.0,,2021-05-07 22:42:56
